{
  "$schema": "https://json-schema.org/draft/2020-12/schema",
  "$id": "issue-file.schema.json",
  "type": "object",
  "additionalProperties": false,
  "required": [
    "id",
    "project_id",
    "iid",
    "title",
    "description",
    "labels",
    "work_order",
    "approval",
    "merge_requests",
    "artifacts",
    "metadata",
    "updated_at"
  ],
  "properties": {
    "id": { "type": "string", "minLength": 1 },
    "project_id": { "type": "string", "minLength": 1 },
    "iid": { "type": "integer", "minimum": 1 },
    "title": { "type": "string", "minLength": 1 },
    "description": { "type": "string" },
    "labels": { "type": "array", "items": { "type": "string", "minLength": 1 } },
    "work_order": { "$ref": "issue-spec.schema.json#/$defs/workOrder" },
    "approval": {
      "type": "object",
      "additionalProperties": false,
      "required": ["label"],
      "properties": {
        "label": { "type": "string", "minLength": 1 },
        "approved": { "type": "boolean" },
        "approved_by": { "type": "string" },
        "approved_at": { "type": ["string", "null"] }
      }
    },
    "merge_requests": { "type": "array", "items": { "type": "string", "minLength": 1 } },
    "artifacts": { "type": "array" },
    "metadata": { "type": "object" },
    "updated_at": { "type": "string", "format": "date-time" }
  }
}
